{
  "meta": {
    "schemaVersion": "1.0",
    "briefingId": "2026-06-11-distribution-is-becoming-as-important-as-the-model",
    "editionDate": "2026-06-11",
    "publishedAt": "2026-06-11T09:00:00Z",
    "slug": "distribution-is-becoming-as-important-as-the-model",
    "language": "en",
    "topics": [
      "ai",
      "distribution",
      "workflow",
      "product-strategy"
    ],
    "readerContext": {
      "roles": [
        "software-engineer",
        "founder",
        "operator"
      ],
      "interests": [
        "ai",
        "workflow",
        "product-strategy"
      ]
    }
  },
  "hero": {
    "title": "The strategic fight is shifting from who has the best model to who owns the workflow around it.",
    "lede": "Assess where strategic value is concentrating as model quality converges. As raw model capability converges, the battle for value is moving up the stack toward workflow ownership, context capture, and distribution.",
    "signal": "Distribution is carrying more strategic weight as raw model differentiation narrows.",
    "thesis": "As raw model capability converges, the battle for value is moving up the stack toward workflow ownership, context capture, and distribution.",
    "promise": "Esta edici\u00f3n ayuda a executives and operators a ubicar d\u00f3nde se est\u00e1 moviendo la ventaja y qu\u00e9 decisi\u00f3n exige.",
    "tension": "Some categories will still reward raw model leadership more than distribution depth."
  },
  "topLine": {
    "title": "Distribution is becoming as important as the model.",
    "body": "As raw model capability converges, the battle for value is moving up the stack toward workflow ownership, context capture, and distribution. Owning the user relationship becomes economically more important. Memory and workflow embedding can become part of the moat. Efecto de segundo orden: Go-to-market strength can compound technical capability rather than merely follow it. Pregunta a vigilar: Which layer keeps the recurring user relationship as model access broadens?",
    "stakes": "Switching costs may rise at the interface layer rather than the model layer."
  },
  "radar": {
    "title": "Evidence radar",
    "items": [
      {
        "label": "Distribution",
        "text": "Distribution is carrying more strategic weight as raw model differentiation narrows.",
        "role": "supports-thesis"
      },
      {
        "label": "Workflow",
        "text": "Context capture is emerging as the scarcer asset than inference alone.",
        "role": "supports-thesis"
      },
      {
        "label": "Product",
        "text": "Interface design is increasingly shaping product economics, not just usability.",
        "role": "monitor"
      }
    ]
  },
  "deepDives": {
    "title": "Mechanism breakdown",
    "items": [
      {
        "title": "1. Distribution is carrying more strategic weight as raw model differentiation narrows",
        "body": "Mecanismo: Multiple product and buyer signals point toward packaging, workflow integration, and reach becoming more decisive than standalone model access. Por qu\u00e9 importa: Owning the user relationship becomes economically more important. Efecto de segundo orden: Go-to-market strength can compound technical capability rather than merely follow it. Tensi\u00f3n a vigilar: Frontier model gaps can still matter in narrow, high-stakes domains.",
        "mechanism": "Distribution",
        "claim": "Distribution is carrying more strategic weight as raw model differentiation narrows.",
        "explanation": "Multiple product and buyer signals point toward packaging, workflow integration, and reach becoming more decisive than standalone model access.",
        "implication": "Owning the user relationship becomes economically more important."
      },
      {
        "title": "2. Context capture is emerging as the scarcer asset than inference alone",
        "body": "Mecanismo: Embedded systems that learn user habits and store reusable context are harder to displace than point solutions that only answer prompts. Por qu\u00e9 importa: Memory and workflow embedding can become part of the moat. Efecto de segundo orden: Switching costs may rise at the interface layer rather than the model layer.",
        "mechanism": "Workflow",
        "claim": "Context capture is emerging as the scarcer asset than inference alone.",
        "explanation": "Embedded systems that learn user habits and store reusable context are harder to displace than point solutions that only answer prompts.",
        "implication": "Memory and workflow embedding can become part of the moat."
      },
      {
        "title": "3. Interface design is increasingly shaping product economics, not just usability",
        "body": "Mecanismo: The interface determines what gets repeated, measured, remembered, and eventually monetized. Por qu\u00e9 importa: The presentation surface influences retention and monetization. Efecto de segundo orden: UI decisions can determine where strategic capture lands.",
        "mechanism": "Product",
        "claim": "Interface design is increasingly shaping product economics, not just usability.",
        "explanation": "The interface determines what gets repeated, measured, remembered, and eventually monetized.",
        "implication": "The presentation surface influences retention and monetization."
      }
    ]
  },
  "marketMap": {
    "title": "Mapa de poder: d\u00f3nde se mueve la ventaja",
    "items": [
      {
        "label": "Ganan poder",
        "text": "Operadores con acceso cre\u00edble a capacidad: chips, energ\u00eda, data centers, redes y equipos capaces de orquestar inferencia a costo controlado.",
        "powerShift": "Owning the user relationship becomes economically more important."
      },
      {
        "label": "Quedan presionados",
        "text": "Compradores y vendors que trataban la nube como una abstracci\u00f3n neutral; ahora deben justificar dependencia, jurisdicci\u00f3n y continuidad operacional.",
        "powerShift": "Switching costs may rise at the interface layer rather than the model layer."
      },
      {
        "label": "Se abre oportunidad",
        "text": "Perfiles puente \u2014software, infraestructura, riesgo y finanzas\u2014 que puedan traducir ambici\u00f3n de IA en arquitectura, procurement y unit economics.",
        "powerShift": "UI decisions can determine where strategic capture lands."
      }
    ]
  },
  "reusableLesson": {
    "title": "Lecci\u00f3n reutilizable",
    "pattern": "Cuando una capacidad base se vuelve commodity, la ventaja migra hacia quien controla la restricci\u00f3n escasa: capacidad, continuidad, regulaci\u00f3n, distribuci\u00f3n o contexto no portable.",
    "applyWhen": [
      "distribution is becoming a moat.",
      "workflow control is a strategic surface.",
      "context accumulates where users return daily."
    ],
    "takeaway": "Owning the user relationship becomes economically more important."
  },
  "watchlist": {
    "title": "Marco de vigilancia",
    "items": [
      {
        "text": "Which layer captures the recurring user relationship?",
        "type": "question"
      },
      {
        "text": "What kinds of context become least portable over time?",
        "type": "question"
      },
      {
        "text": "Which products turn occasional use into operational dependency?",
        "type": "question"
      },
      {
        "text": "Which layer keeps the recurring user relationship as model access broadens?",
        "type": "question"
      },
      {
        "text": "Where will the most valuable non-portable context accumulate?",
        "type": "question"
      }
    ]
  },
  "readerTranslation": {
    "title": "Qu\u00e9 cambia para ti",
    "items": [
      {
        "role": "software-engineer",
        "headline": "Qu\u00e9 cambia para software-engineer",
        "body": "Para un software engineer, la ventaja es dise\u00f1ar con restricciones reales: costo de inferencia, latencia, capacidad disponible, soberan\u00eda y continuidad operacional.",
        "weight": 0.5
      },
      {
        "role": "founder",
        "headline": "Qu\u00e9 cambia para founder",
        "body": "Para un founder, la ventaja es convertir infraestructura confiable en promesa comercial: no vender magia de IA, sino capacidad repetible con unit economics defendibles.",
        "weight": 0.3
      },
      {
        "role": "operator",
        "headline": "Qu\u00e9 cambia para operator",
        "body": "Para un operator, la ventaja es comprar y gobernar IA como sistema cr\u00edtico: vendor risk, jurisdicci\u00f3n, presupuesto, SLAs y dependencia operacional.",
        "weight": 0.2
      }
    ]
  }
}
